{
 "episode": "swallowed-gum",
 "theme": "flat-cast",
 "kits": [
  "body",
  "kinetic"
 ],
 "flagship": "House method: organ cast and flat props carry a story with a turn; moving type for the one big number.",
 "drift": 0.06,
 "scenes": [
  {
   "id": "s_hook",
   "type": "custom",
   "start": "0",
   "params": {
    "fn": "hook",
    "why": "Gut Gang house method (user 2026-10-06; rewrite 2026-10-07): the organ cast and flat props tell the story, moving type for the one big number."
   },
   "events": [
    {
     "at": "hook/seven",
     "do": "verdict",
     "sfx": "stamp"
    }
   ]
  },
  {
   "id": "s_unit",
   "type": "character_dialog",
   "start": "unit.start-0.15",
   "params": {
    "cast": [
     "stomach"
    ],
    "setting": "stomach",
    "moods": {
     "stomach": "angry"
    },
    "bubbles": {
     "unit": "7 YEARS? I'M NOT A STORAGE UNIT."
    }
   },
   "events": []
  },
  {
   "id": "s_base",
   "type": "custom",
   "start": "base.start-0.15",
   "params": {
    "fn": "base",
    "why": "Gut Gang house method (user 2026-10-06; rewrite 2026-10-07): the organ cast and flat props tell the story, moving type for the one big number."
   },
   "events": [
    {
     "at": "base/sweeteners",
     "do": "reveal",
     "sfx": "pop"
    },
    {
     "at": "base/doesn't",
     "do": "verdict",
     "sfx": "stamp"
    }
   ]
  },
  {
   "id": "s_empty",
   "type": "custom",
   "start": "empty.start-0.15",
   "params": {
    "fn": "empty",
    "why": "Gut Gang house method (user 2026-10-06; rewrite 2026-10-07): the organ cast and flat props tell the story, moving type for the one big number."
   },
   "events": [
    {
     "at": "empty/two",
     "do": "count_start",
     "sfx": "tick"
    },
    {
     "at": "empty/rides",
     "do": "reveal",
     "sfx": "whoosh"
    }
   ]
  },
  {
   "id": "s_refuse",
   "type": "character_dialog",
   "start": "refuse.start-0.15",
   "params": {
    "cast": [
     "gut_microbes"
    ],
    "setting": "gut",
    "microbe_kind": "rod",
    "moods": {
     "gut_microbes": "angry"
    }
   },
   "events": []
  },
  {
   "id": "s_week",
   "type": "custom",
   "start": "week.start-0.15",
   "params": {
    "fn": "doctors",
    "why": "Gut Gang house method (user 2026-10-06; rewrite 2026-10-07): the organ cast and flat props tell the story, moving type for the one big number."
   },
   "events": [
    {
     "at": "week/week",
     "do": "verdict",
     "sfx": "stamp"
    }
   ]
  },
  {
   "id": "s_catch",
   "type": "custom",
   "start": "catch.start-0.15",
   "params": {
    "fn": "catch",
    "why": "Gut Gang house method (user 2026-10-06; rewrite 2026-10-07): the organ cast and flat props tell the story, moving type for the one big number."
   },
   "events": [
    {
     "at": "catch/catch",
     "do": "emphasize",
     "sfx": "thud"
    }
   ]
  },
  {
   "id": "s_reward",
   "type": "custom",
   "start": "catch/kids-0.1",
   "params": {
    "fn": "reward",
    "why": "Gut Gang house method (user 2026-10-06; rewrite 2026-10-07): the organ cast and flat props tell the story, moving type for the one big number.",
    "cut": true
   },
   "events": [
    {
     "at": "catch/swallowed",
     "do": "reveal",
     "sfx": "pop"
    }
   ]
  },
  {
   "id": "s_mass",
   "type": "custom",
   "start": "mass.start-0.15",
   "params": {
    "fn": "mass",
    "why": "Gut Gang house method (user 2026-10-06; rewrite 2026-10-07): the organ cast and flat props tell the story, moving type for the one big number."
   },
   "events": [
    {
     "at": "mass/pulled",
     "do": "verdict",
     "sfx": "stamp"
    }
   ]
  },
  {
   "id": "s_coins",
   "type": "custom",
   "start": "coins.start-0.15",
   "params": {
    "fn": "coins",
    "why": "Gut Gang house method (user 2026-10-06; rewrite 2026-10-07): the organ cast and flat props tell the story, moving type for the one big number."
   },
   "events": [
    {
     "at": "coins/glued",
     "do": "reveal",
     "sfx": "thud"
    }
   ]
  },
  {
   "id": "s_toll",
   "type": "character_dialog",
   "start": "toll.start-0.15",
   "params": {
    "cast": [
     "stomach",
     "gut_microbes"
    ],
    "setting": "spotlight",
    "title": "SPIT IT OUT",
    "moods": {
     "stomach": "smug"
    }
   },
   "events": []
  }
 ]
}