{
 "episode": "alaska-sale",
 "kits": [
  "paper",
  "kinetic",
  "flight",
  "flagart"
 ],
 "flags": [
  "US",
  "RU",
  "GB"
 ],
 "flagship": "House method (user 2026-10-06): A's characters and paper props, B's 3D map flights for the geography beats, C's moving type for the one big number.",
 "scenes": [
  {
   "id": "s_hook",
   "type": "custom",
   "start": "0",
   "params": {
    "fn": "hook",
    "why": "House method: paper characters and props (paper kit), 3D map flights for geography (flight kit), moving type for the one big number (kinetic kit).",
    "region": [
     -180.0,
     51.0,
     -129.0,
     72.0
    ]
   },
   "events": [
    {
     "at": "hook/bought",
     "do": "reveal",
     "sfx": "pop"
    },
    {
     "at": "hook/cents",
     "do": "verdict",
     "sfx": "stamp"
    }
   ]
  },
  {
   "id": "s_why",
   "type": "custom",
   "start": "why.start",
   "params": {
    "fn": "why",
    "why": "House method: paper characters and props (paper kit), 3D map flights for geography (flight kit), moving type for the one big number (kinetic kit)."
   },
   "events": [
    {
     "at": "why/lost",
     "do": "verdict",
     "sfx": "stamp"
    },
    {
     "at": "why/money",
     "do": "reveal",
     "sfx": "pop"
    }
   ]
  },
  {
   "id": "s_defend",
   "type": "custom",
   "start": "defend.start",
   "params": {
    "fn": "defend",
    "why": "House method: paper characters and props (paper kit), 3D map flights for geography (flight kit), moving type for the one big number (kinetic kit).",
    "region": [
     -180.0,
     58.5,
     -115.0,
     72.0
    ]
   },
   "events": [
    {
     "at": "defend/britain",
     "do": "highlight",
     "sfx": "whoosh"
    }
   ]
  },
  {
   "id": "s_settlers",
   "type": "custom",
   "start": "settlers.start",
   "params": {
    "fn": "settlers",
    "why": "House method: paper characters and props (paper kit), 3D map flights for geography (flight kit), moving type for the one big number (kinetic kit).",
    "region": [
     -180.0,
     51.0,
     -129.0,
     72.0
    ],
    "cut": true
   },
   "events": [
    {
     "at": "settlers/four",
     "do": "count_start",
     "sfx": "pop"
    }
   ]
  },
  {
   "id": "s_price",
   "type": "custom",
   "start": "price.start",
   "params": {
    "fn": "price",
    "why": "House method: paper characters and props (paper kit), 3D map flights for geography (flight kit), moving type for the one big number (kinetic kit)."
   },
   "events": [
    {
     "at": "price/seven",
     "do": "count_start",
     "sfx": "pop"
    },
    {
     "at": "price/twice",
     "do": "reveal",
     "sfx": "stamp"
    }
   ]
  },
  {
   "id": "s_folly",
   "type": "custom",
   "start": "folly.start",
   "params": {
    "fn": "folly",
    "why": "House method: paper characters and props (paper kit), 3D map flights for geography (flight kit), moving type for the one big number (kinetic kit)."
   },
   "events": [
    {
     "at": "folly/folly",
     "do": "reveal",
     "sfx": "stamp"
    },
    {
     "at": "folly/icebox",
     "do": "reveal",
     "sfx": "thud"
    }
   ]
  },
  {
   "id": "s_gold",
   "type": "custom",
   "start": "gold.start",
   "params": {
    "fn": "gold",
    "why": "House method: paper characters and props (paper kit), 3D map flights for geography (flight kit), moving type for the one big number (kinetic kit)."
   },
   "events": [
    {
     "at": "gold/gold",
     "do": "reveal",
     "sfx": "pop"
    },
    {
     "at": "gold/gateway",
     "do": "reveal",
     "sfx": "pop"
    }
   ]
  },
  {
   "id": "s_border",
   "type": "custom",
   "start": "border.start",
   "params": {
    "fn": "border",
    "why": "House method: paper characters and props (paper kit), 3D map flights for geography (flight kit), moving type for the one big number (kinetic kit).",
    "region": [
     -180.0,
     50.5,
     -115.0,
     73.0
    ]
   },
   "events": [
    {
     "at": "border/border",
     "do": "draw",
     "sfx": "whoosh"
    },
    {
     "at": "border/islands",
     "do": "reveal",
     "sfx": "pop"
    }
   ]
  },
  {
   "id": "s_diomede",
   "type": "custom",
   "start": "diomede.start",
   "params": {
    "fn": "diomede",
    "why": "House method: paper characters and props (paper kit), 3D map flights for geography (flight kit), moving type for the one big number (kinetic kit).",
    "region": [
     -169.35,
     65.62,
     -168.7,
     65.92
    ],
    "coast": "osm",
    "cut": true
   },
   "events": [
    {
     "at": "diomede/big",
     "do": "reveal",
     "sfx": "pop"
    },
    {
     "at": "diomede/little",
     "do": "reveal",
     "sfx": "pop"
    },
    {
     "at": "diomede/two",
     "do": "emphasize",
     "sfx": "tick"
    }
   ]
  },
  {
   "id": "s_dateline",
   "type": "custom",
   "start": "dateline.start",
   "params": {
    "fn": "dateline",
    "why": "House method: paper characters and props (paper kit), 3D map flights for geography (flight kit), moving type for the one big number (kinetic kit).",
    "region": [
     -169.35,
     65.62,
     -168.7,
     65.92
    ],
    "coast": "osm",
    "cut": true
   },
   "events": [
    {
     "at": "dateline/date",
     "do": "draw",
     "sfx": "whoosh"
    },
    {
     "at": "dateline/twentyone",
     "do": "verdict",
     "sfx": "stamp"
    }
   ]
  },
  {
   "id": "s_toll",
   "type": "custom",
   "start": "toll.start",
   "params": {
    "fn": "toll",
    "why": "House method: paper characters and props (paper kit), 3D map flights for geography (flight kit), moving type for the one big number (kinetic kit)."
   },
   "events": [
    {
     "at": "toll/cents",
     "do": "reveal",
     "sfx": "stamp"
    },
    {
     "at": "toll/tomorrow",
     "do": "reveal",
     "sfx": "pop"
    }
   ]
  }
 ],
 "drift": 0.06
}