{
 "episode": "stomach-acid",
 "theme": "flat-cast",
 "kits": [
  "body",
  "kinetic"
 ],
 "flagship": "House method: organ cast and flat props carry a story with a turn; moving type for the one big number.",
 "drift": 0.06,
 "scenes": [
  {
   "id": "s_hook",
   "type": "custom",
   "start": "0",
   "params": {
    "fn": "hook",
    "why": "Gut Gang house method (user 2026-10-06; rewrite 2026-10-07): the organ cast and flat props tell the story, moving type for the one big number."
   },
   "events": [
    {
     "at": "hook/zinc",
     "do": "reveal",
     "sfx": "pop"
    },
    {
     "at": "hook/so",
     "do": "highlight",
     "sfx": "whoosh"
    }
   ]
  },
  {
   "id": "s_ask",
   "type": "character_dialog",
   "start": "ask.start-0.15",
   "params": {
    "cast": [
     "stomach"
    ],
    "setting": "stomach",
    "moods": {
     "stomach": "worried"
    }
   },
   "events": []
  },
  {
   "id": "s_mucus",
   "type": "custom",
   "start": "mucus.start-0.15",
   "params": {
    "fn": "mucus",
    "why": "Gut Gang house method (user 2026-10-06; rewrite 2026-10-07): the organ cast and flat props tell the story, moving type for the one big number."
   },
   "events": [
    {
     "at": "mucus/mucus",
     "do": "reveal",
     "sfx": "pop"
    },
    {
     "at": "mucus/bicarbonate",
     "do": "reveal",
     "sfx": "pop"
    }
   ]
  },
  {
   "id": "s_coat",
   "type": "custom",
   "start": "coat.start-0.15",
   "params": {
    "fn": "coat",
    "why": "Gut Gang house method (user 2026-10-06; rewrite 2026-10-07): the organ cast and flat props tell the story, moving type for the one big number."
   },
   "events": [
    {
     "at": "coat/raincoat",
     "do": "reveal",
     "sfx": "pop"
    }
   ]
  },
  {
   "id": "s_turn",
   "type": "custom",
   "start": "turn.start-0.15",
   "params": {
    "fn": "turn",
    "why": "Gut Gang house method (user 2026-10-06; rewrite 2026-10-07): the organ cast and flat props tell the story, moving type for the one big number."
   },
   "events": [
    {
     "at": "turn/corkscrews",
     "do": "emphasize",
     "sfx": "whoosh"
    }
   ]
  },
  {
   "id": "s_hi",
   "type": "custom",
   "start": "hi.start-0.15",
   "params": {
    "fn": "hi",
    "why": "Gut Gang house method (user 2026-10-06; rewrite 2026-10-07): the organ cast and flat props tell the story, moving type for the one big number."
   },
   "events": [
    {
     "at": "hi/half",
     "do": "reveal",
     "sfx": "pop"
    }
   ]
  },
  {
   "id": "s_blame",
   "type": "custom",
   "start": "blame.start-0.15",
   "params": {
    "fn": "blame",
    "why": "Gut Gang house method (user 2026-10-06; rewrite 2026-10-07): the organ cast and flat props tell the story, moving type for the one big number."
   },
   "events": [
    {
     "at": "blame/stress",
     "do": "reveal",
     "sfx": "pop"
    },
    {
     "at": "blame/spicy",
     "do": "reveal",
     "sfx": "pop"
    }
   ]
  },
  {
   "id": "s_drank",
   "type": "custom",
   "start": "drank.start-0.15",
   "params": {
    "fn": "drank",
    "why": "Gut Gang house method (user 2026-10-06; rewrite 2026-10-07): the organ cast and flat props tell the story, moving type for the one big number."
   },
   "events": [
    {
     "at": "drank/drank",
     "do": "emphasize",
     "sfx": "thud"
    }
   ]
  },
  {
   "id": "s_sick",
   "type": "custom",
   "start": "sick.start-0.15",
   "params": {
    "fn": "sick",
    "why": "Gut Gang house method (user 2026-10-06; rewrite 2026-10-07): the organ cast and flat props tell the story, moving type for the one big number."
   },
   "events": [
    {
     "at": "sick/sick",
     "do": "reveal",
     "sfx": "pop"
    }
   ]
  },
  {
   "id": "s_nobel",
   "type": "custom",
   "start": "nobel.start-0.15",
   "params": {
    "fn": "nobel",
    "why": "Gut Gang house method (user 2026-10-06; rewrite 2026-10-07): the organ cast and flat props tell the story, moving type for the one big number."
   },
   "events": [
    {
     "at": "nobel/two",
     "do": "count_start",
     "sfx": "stamp"
    }
   ]
  },
  {
   "id": "s_toll",
   "type": "character_dialog",
   "start": "toll.start-0.15",
   "params": {
    "cast": [
     "stomach",
     "gut_microbes"
    ],
    "setting": "spotlight",
    "title": "STOPPED BY SNOT. MOSTLY.",
    "microbe_kind": "spiral",
    "moods": {
     "stomach": "proud",
     "gut_microbes": "smug"
    }
   },
   "events": []
  }
 ]
}